image,gt_text,ocr_text,match
handwritten_000.png,put down a resolution on the subject,down 9 vesolution  he,NO
handwritten_001.png,and he is to be backed by Mr. Will,he 6 do G 66 backcd,NO
handwritten_002.png,nominating any more Labour life Peers,Labour life ay more,NO
handwritten_003.png,M Ps tomorrow. Mr. Michael Foot has,domorroro. Mw. Micuael,NO
handwritten_004.png,"Griffiths, M P for Manchester Exchange .",,NO
handwritten_005.png,is to be made at a meeting of Labour,Y y00m 6 F orom be 0,NO
